{
  "schema_version": "1.0",
  "dataset_name": "Cherokee Words Starter Seed",
  "created_on": "2026-03-11",
  "notes": [
    "This file is the canonical seed dataset for Cherokee vocabulary in this project.",
    "Romanized pronunciations are source-provided learner spellings, not strict phonemic transcriptions.",
    "IPA is intentionally left null until each entry is reviewed against a stronger pronunciation source.",
    "Where sources disagree, the primary form keeps the pronunciation-bearing source and alternate spellings are preserved in alternates."
  ],
  "sources": [
    {
      "id": "carbon_chr_us",
      "name": "Carbon Cherokee locale",
      "kind": "repo",
      "citation": "vendor/nesbot/carbon/src/Carbon/Lang/chr_US.php",
      "url": null,
      "path": "vendor/nesbot/carbon/src/Carbon/Lang/chr_US.php"
    },
    {
      "id": "shiyo_months",
      "name": "Shiyo Cherokee Language Engine - Months",
      "kind": "web",
      "citation": "Shiyo months category page",
      "url": "https://shiyo.org/months",
      "path": null
    },
    {
      "id": "shiyo_days",
      "name": "Shiyo Cherokee Language Engine - Days of the Week",
      "kind": "web",
      "citation": "Shiyo days-of-the-week category page",
      "url": "https://shiyo.org/days-of-the-week",
      "path": null
    },
    {
      "id": "shiyo_greetings",
      "name": "Shiyo Cherokee Language Engine - Greetings",
      "kind": "web",
      "citation": "Shiyo greetings phrase detail page",
      "url": "https://shiyo.org/phrases/greetings/4",
      "path": null
    },
    {
      "id": "ced_first500",
      "name": "Cherokee English Dictionary - First 500",
      "kind": "web",
      "citation": "Cherokee English Dictionary First 500 curated vocabulary page",
      "url": "https://www.cherokeedictionary.net/first500",
      "path": null
    }
  ],
  "entries": [
    {
      "id": "month-january",
      "cherokee": "ᎤᏃᎸᏔᏂ",
      "transliteration": "U-no-lv-ta-ni",
      "ipa": null,
      "english": "January",
      "category": "calendar.month",
      "source": "shiyo_months",
      "source_note": "Primary form uses the Shiyo learner spelling and syllabary so pronunciation guidance and script stay together.",
      "confidence": "medium",
      "dialect": "Eastern source context",
      "notes": "Carbon locale in the repo preserves a variant final syllable for this month name.",
      "alternates": [
        {
          "cherokee": "ᎤᏃᎸᏔᏅ",
          "transliteration": null,
          "ipa": null,
          "source": "carbon_chr_us",
          "note": "Variant syllabary form already present in the repository locale file."
        }
      ]
    },
    {
      "id": "month-february",
      "cherokee": "ᎧᎦᎵ",
      "transliteration": "Ka-ga-li",
      "ipa": null,
      "english": "February",
      "category": "calendar.month",
      "source": "shiyo_months",
      "source_note": "Shiyo provides both learner spelling and syllabary for this month name.",
      "confidence": "medium",
      "dialect": "Eastern source context",
      "notes": "Matches the Carbon locale form already present in the repository."
    },
    {
      "id": "month-march",
      "cherokee": "ᎠᏅᏱ",
      "transliteration": "A-nv-yi",
      "ipa": null,
      "english": "March",
      "category": "calendar.month",
      "source": "shiyo_months",
      "source_note": "Shiyo provides both learner spelling and syllabary for this month name.",
      "confidence": "medium",
      "dialect": "Eastern source context",
      "notes": "Matches the Carbon locale form already present in the repository."
    },
    {
      "id": "month-april",
      "cherokee": "ᎧᏬᏂ",
      "transliteration": "Ka-wo-ni",
      "ipa": null,
      "english": "April",
      "category": "calendar.month",
      "source": "shiyo_months",
      "source_note": "Shiyo provides both learner spelling and syllabary for this month name.",
      "confidence": "medium",
      "dialect": "Eastern source context",
      "notes": "Matches the Carbon locale form already present in the repository."
    },
    {
      "id": "month-may",
      "cherokee": "ᎠᏂᏍᎬᏗ",
      "transliteration": "A-ni-sgv-di",
      "ipa": null,
      "english": "May",
      "category": "calendar.month",
      "source": "shiyo_months",
      "source_note": "Primary form uses the Shiyo learner spelling and syllabary so pronunciation guidance and script stay together.",
      "confidence": "medium",
      "dialect": "Eastern source context",
      "notes": "Carbon locale in the repo uses a nearby d/t variant at the end of the word.",
      "alternates": [
        {
          "cherokee": "ᎠᏂᏍᎬᏘ",
          "transliteration": null,
          "ipa": null,
          "source": "carbon_chr_us",
          "note": "Variant syllabary form already present in the repository locale file."
        }
      ]
    },
    {
      "id": "month-june",
      "cherokee": "ᏕᎭᎷᏱ",
      "transliteration": "De-ha-lu-yi",
      "ipa": null,
      "english": "June",
      "category": "calendar.month",
      "source": "shiyo_months",
      "source_note": "Shiyo provides both learner spelling and syllabary for this month name.",
      "confidence": "medium",
      "dialect": "Eastern source context",
      "notes": "Matches the Carbon locale form already present in the repository."
    },
    {
      "id": "month-july",
      "cherokee": "ᎫᏰᏉᏂ",
      "transliteration": "Gu-ye-gwo-ni",
      "ipa": null,
      "english": "July",
      "category": "calendar.month",
      "source": "shiyo_months",
      "source_note": "Shiyo provides both learner spelling and syllabary for this month name.",
      "confidence": "medium",
      "dialect": "Eastern source context",
      "notes": "Matches the Carbon locale form already present in the repository."
    },
    {
      "id": "month-august",
      "cherokee": "ᎦᎶᏂ",
      "transliteration": "Ga-lo-ni",
      "ipa": null,
      "english": "August",
      "category": "calendar.month",
      "source": "shiyo_months",
      "source_note": "Shiyo provides both learner spelling and syllabary for this month name.",
      "confidence": "medium",
      "dialect": "Eastern source context",
      "notes": "Matches the Carbon locale form already present in the repository."
    },
    {
      "id": "month-september",
      "cherokee": "ᏚᎵᎢᏍᏗ",
      "transliteration": "Du-li-i-sdi",
      "ipa": null,
      "english": "September",
      "category": "calendar.month",
      "source": "shiyo_months",
      "source_note": "Primary form uses the Shiyo learner spelling and syllabary so pronunciation guidance and script stay together.",
      "confidence": "medium",
      "dialect": "Eastern source context",
      "notes": "The repository locale file preserves a shorter spelling variant for the same month.",
      "alternates": [
        {
          "cherokee": "ᏚᎵᏍᏗ",
          "transliteration": null,
          "ipa": null,
          "source": "carbon_chr_us",
          "note": "Variant syllabary form already present in the repository locale file."
        }
      ]
    },
    {
      "id": "month-october",
      "cherokee": "ᏚᏂᏂᏗ",
      "transliteration": "Du-nin-di",
      "ipa": null,
      "english": "October",
      "category": "calendar.month",
      "source": "shiyo_months",
      "source_note": "Primary form uses the Shiyo learner spelling and syllabary so pronunciation guidance and script stay together.",
      "confidence": "medium",
      "dialect": "Eastern source context",
      "notes": "The repository locale file preserves a different middle syllable for this month name.",
      "alternates": [
        {
          "cherokee": "ᏚᏂᏅᏗ",
          "transliteration": null,
          "ipa": null,
          "source": "carbon_chr_us",
          "note": "Variant syllabary form already present in the repository locale file."
        }
      ]
    },
    {
      "id": "month-november",
      "cherokee": "ᏅᏓᏕᏆ",
      "transliteration": "Nv-da-de-gwa",
      "ipa": null,
      "english": "November",
      "category": "calendar.month",
      "source": "shiyo_months",
      "source_note": "Shiyo provides both learner spelling and syllabary for this month name.",
      "confidence": "medium",
      "dialect": "Eastern source context",
      "notes": "Matches the Carbon locale form already present in the repository."
    },
    {
      "id": "month-december",
      "cherokee": "ᎥᏍᎩᏱ",
      "transliteration": "V-sgi-yi",
      "ipa": null,
      "english": "December",
      "category": "calendar.month",
      "source": "shiyo_months",
      "source_note": "Shiyo provides both learner spelling and syllabary for this month name.",
      "confidence": "medium",
      "dialect": "Eastern source context",
      "notes": "Matches the Carbon locale form already present in the repository."
    },
    {
      "id": "weekday-sunday",
      "cherokee": "ᎤᎾᏙᏓᏆᏍᎬᎢ",
      "transliteration": "U-na-do-da-gwa-sgv-i",
      "ipa": null,
      "english": "Sunday",
      "category": "calendar.weekday",
      "source": "shiyo_days",
      "source_note": "Primary form uses the Shiyo learner spelling and syllabary so pronunciation guidance and script stay together.",
      "confidence": "medium",
      "dialect": "Eastern source context",
      "notes": "The repository locale file preserves a close variant without the final syllable.",
      "alternates": [
        {
          "cherokee": "ᎤᎾᏙᏓᏆᏍᎬ",
          "transliteration": null,
          "ipa": null,
          "source": "carbon_chr_us",
          "note": "Variant syllabary form already present in the repository locale file."
        }
      ]
    },
    {
      "id": "weekday-monday",
      "cherokee": "ᎤᎾᏙᏓᏉᏅᎯ",
      "transliteration": "U-na-do-da-gwo-nv-hi",
      "ipa": null,
      "english": "Monday",
      "category": "calendar.weekday",
      "source": "shiyo_days",
      "source_note": "Shiyo provides both learner spelling and syllabary for this weekday name.",
      "confidence": "medium",